,created_at,text,full_text
0,Tue Jul 14 06:01:38 +0000 2020,"Kota Manado yang ku cintai
Kita nyanda mo lupa..,

HBD Kota Manado.., Semoga semakin lebih sehat, lebih maju, lebihâ¦ https://t.co/6I94natCQv","Kota Manado yang ku cintai
Kita nyanda mo lupa..,

HBD Kota Manado.., Semoga semakin lebih sehat, lebih maju, lebih cerdas dan lebih hebat..ðððð»

Si Tou Timou Tumouâ¦ https://t.co/VoL7xdj8Db"
1,Thu Feb 07 14:24:19 +0000 2019,"DBD Makan Korban, Perindo Giatkan Fogging di Kota Manado

https://t.co/EhyvNrPySC",
2,Fri Aug 16 14:51:25 +0000 2013,"Segera Hadir di Kota Manado ""Kursus Estetika All In One"" (Super Lengkap)

Â¤ Materi Dokter &amp; Kalangan Umum... http://t.co/GLNfqagNbP",
3,Fri Feb 03 15:50:38 +0000 2017,"Data Resmi Rumah Sakit di Kota Manado Provinsi Sulawesi Utara Republik Indonesia, Lengkap dan Valid https://t.co/UIn0C2r8tS",
4,Fri Jan 27 15:23:38 +0000 2017,"Data Resmi Puskesmas di Kota Manado Provinsi Sulawesi Utara Republik Indonesia, https://t.co/7r4JNBqSh8 #lengkapseluruhpublichealthservice",
5,Thu Feb 15 07:07:02 +0000 2018,Cara Menghilangkan Bau Mulut Dengan Obat Kumur Joypolinse | Agen Di KotaÂ Manado https://t.co/uN5qGGVNVe https://t.co/AAxYuH35Bu,
6,Mon Mar 11 06:29:36 +0000 2013,Timsel KPU Sulut Dinilai Tidak âBerakal Sehatâ http://t.co/pkSPz5O4j0 via @beritamanado,
7,Fri Jul 05 08:39:13 +0000 2013,"Tmn"" bsk ada month jalan sehat, jam 5 so dimka IT, dlm rangka Hut kota manado, smua harus hadir karna mo absen. Pke bju olahrga cln jeans.",
8,Sat Jan 26 06:23:37 +0000 2013,Kecamatan Malalayang catat kasus demam berdarah tertinggi di kota Manado.,
9,Thu Oct 30 01:05:11 +0000 2014,Dinkes Tindaklanjuti Kasus Keracunan Wakil Wali Kota Manado: Mottoh memastikan tidak ada efek jangka panja... http://t.co/5jlkXbyZ1e #fb,
10,Wed Oct 29 05:50:30 +0000 2014,"Hut ke-39, Wawali Manado  Terbaring sakit: Mendapat ribuan ucapan selamat ulang tahun dari warga Kota Manado, ... http://t.co/mQQL5Wd5Ax",
11,Sun Jan 21 05:08:41 +0000 2018,Bisnis Online Dokter Di Kota Manado https://t.co/B4Bv0WSIZL https://t.co/JNm3A6lFVl,
12,Wed May 01 04:08:26 +0000 2019,"Memperingati Hari Buruh Internasional 1 Mei 2019 dengan Tema MAY DAY, TOGETHER WE GROW Yang bertempat di God Blessâ¦ https://t.co/ngkhUQ3cAz","Memperingati Hari Buruh Internasional 1 Mei 2019 dengan Tema MAY DAY, TOGETHER WE GROW Yang bertempat di God Bless Park Sekaligus Menerima Perjanjian Kerjasama Pemerintah Kota Manado dan BPJS KK untuk... https://t.co/U603zOlPs4"
13,Wed Feb 06 08:16:14 +0000 2019,"Banjir Kota Manado, Pemkab Boltim Terus Lakukan Bantuan Kesehatan Gratis - https://t.co/mTbKQEkAXe https://t.co/n7rc1Vnsgz",
14,Sun Jul 22 08:33:24 +0000 2018,"Balai Besar Pengawasan Obat dan Makanan (BBPOM) Kota Manado, Sulawesi Utara menyita ribuan produk kosmetik ilegal dâ¦ https://t.co/a9FWUcs8ji","Balai Besar Pengawasan Obat dan Makanan (BBPOM) Kota Manado, Sulawesi Utara menyita ribuan produk kosmetik ilegal dan palsu senilai Rp 1 miliar dari sebuah gudang. #Liputan6SCTV https://t.co/WnAnvV9atl"
15,Sat Dec 24 07:33:55 +0000 2016,Yeayyy.... ketemu ibu dokter kebanggaan kota Manado ðð¬... Kenzo kwa masihâ¦ (w/ rillya at @vonnettebarbers) [pic] â https://t.co/LNArx5Lecv,
16,Fri Mar 15 14:00:00 +0000 2019,"Nggak mau lagi lihat warga ketakutan karena nyamuk DBD, Caleg Perindo Robert Tambuwun asapi Kota Manado.â¦ https://t.co/LkRnp3o4IQ","Nggak mau lagi lihat warga ketakutan karena nyamuk DBD, Caleg Perindo Robert Tambuwun asapi Kota Manado. https://t.co/Dr7RxPDQ6w | Ketum Partai Perindo @Hary_Tanoe
#PerindoUpdate"
17,Tue Feb 19 19:36:53 +0000 2013,95 Orang Menderita Sakit di Posko Pengungsian Termasuk Balita http://t.co/FGjkusDM,
18,Wed Nov 04 04:30:32 +0000 2015,Sosialisasi BPJS bersama Disnaker Manado ðð¼ðð¼ (at Dinas Tenaga Kerja Kota Manado) [pic] â https://t.co/MPqd6v9R7s,
19,Fri Dec 11 13:45:02 +0000 2020,"Anyone, siapa yg punya law of the jungle kota manado pas ep. Jin sakit? Antara ep 249-251 
Sampe capek nyari ga nemu2ð­",
20,Sat Jan 17 02:21:09 +0000 2015,"Warga Manado yang Belum Tercover Jaminan Kesehatan, Tetap Dijamin!: Pemerintah Kota Manado, Sulawesi Utara, ma... http://t.co/5FfcNcPtvt",
21,Wed Feb 14 22:59:33 +0000 2018,@beritamanado Min. Saran utk selidiki berita ttg klinik klinik di kota manado yg mempersulit atau menolak utk membuâ¦ https://t.co/RwFyPnrmwy,"@beritamanado Min. Saran utk selidiki berita ttg klinik klinik di kota manado yg mempersulit atau menolak utk membuat surat rekomendasi ke dokter spesialis/RS bagi pelanggan BPJS.

Ada informasi yg mengatakan ada klinik yg dokternya dgn sengaja melakukan hal demikian. 

Cc: @BPJSKesehatanRI"
22,Tue Jun 02 06:01:32 +0000 2020,"Keributan kembali terjadi di Rumah Sakit GMIM Pancaran Kasih Kota Manado, Sulawesi Utara, pada Selasa (2/6/2020) paâ¦ https://t.co/33uUijQmvU","Keributan kembali terjadi di Rumah Sakit GMIM Pancaran Kasih Kota Manado, Sulawesi Utara, pada Selasa (2/6/2020) pagi. https://t.co/4uY4E5s4at"
23,Tue Mar 12 04:27:11 +0000 2013,Kunjungi Pasar dan Rumah Sakit http://t.co/9VZTq3Q7Gk,
24,Wed Aug 21 18:35:17 +0000 2013,Manado â Dewan Perwakilan Rakyat Daerah (DPRD) Kota Manado meminta Dinas Kesehatan (Dinkes) untuk melakukan... http://t.co/LRZUoy3UNT,
25,Thu Jul 11 01:30:31 +0000 2013,Anfrak obat.. ð·ðð (at Dinas Kesehatan Kota Manado) â https://t.co/AP7IORwk1p,
26,Wed Feb 25 10:06:40 +0000 2015,"Telusuri Korban DBD di Puskesmas, Komisi 4 Turun Lapangan Lintas Kabupaten dan Kota: Manado â Komisi 4 DPRD be... http://t.co/b5lJfgIqnR",
27,Thu Feb 14 14:32:28 +0000 2013,Waspada Penyakit Musiman: IDMANADO/Manado â Curah hujan yang masih sering mengguyur kota Manado dan sekitarnya t... http://t.co/Fu3HJGzJ,
28,Tue Jul 01 19:39:48 +0000 2014,"Go follow! @tunakaleng yuk cobain tuna kaleng lezat, sehat dan bergizi khas kota manado. Info : 081219965399 Pin bb :74C49D61""",
29,Thu Jan 30 01:28:59 +0000 2014,"#KabarMdo Pasca Bencana, Penyakit ISPA Perlu Diantisipasi: Manado â Legislator Kota Manado, Lily Binti menyeru... http://t.co/da3bSMKYwO",
30,Mon May 29 22:09:16 +0000 2017,"Berita Kawanua - Pembangunan RSUD Kota Manado Terus Berpolemik, Komisi C Tegaskan Harus Punya Amdal https://t.co/rbxjMWsxtE",
31,Sat Jul 19 00:30:02 +0000 2014,Ada lho Dokter Bertarif Murah di Malalayang Manado: MASYARAKAT Kota Manado masih bisa mendapatkan pelayanan ma... http://t.co/1u5gDWDwoJ,
32,Thu Oct 30 01:05:46 +0000 2014,Dinkes Tindaklanjuti Kasus Keracunan Wakil Wali Kota Manado http://t.co/NisiYnV3QA,
33,Tue Jan 22 06:06:54 +0000 2013,RS Siti Maryam âCuekâ Program Universal Coverage http://t.co/NOO5WyDY via @beritamanado,
34,Wed Jul 24 23:38:18 +0000 2019,"Pembangunan Rumah Sakit Hermina yang berlokasi di Kelurahan Kairagi, Kecamatan Mapanget, disorot anggota DPRD Kotaâ¦ https://t.co/ihfzGfcL8o","Pembangunan Rumah Sakit Hermina yang berlokasi di Kelurahan Kairagi, Kecamatan Mapanget, disorot anggota DPRD Kota Manado karena tidak mengantongi Izin Mendirikan Bangunan. #ManadoPost #WWP"
35,Fri Nov 23 23:54:16 +0000 2018,Demam berdarah dengue (DBD) masih menjadi momok bagi masyarakat di Sulut. Kota Manado membukukan ada 12 kasus positâ¦ https://t.co/WArc0kag6b,"Demam berdarah dengue (DBD) masih menjadi momok bagi masyarakat di Sulut. Kota Manado membukukan ada 12 kasus positif DBD sampai bulan Oktober untuk tahun berjalan, data Dinas Kesehatan Prvinsi Sulut. #TribunManado #WWP"
36,Thu Oct 30 01:03:08 +0000 2014,",, Dinkes Tindaklanjuti Kasus Keracunan Wakil Wali Kota Manado: Mottoh memastikan tidak ada efek jangka panjan... http://t.co/4nuCjyGnwB",
37,Thu Sep 19 22:17:38 +0000 2013,"Jalan sehat bersama warga kota manado dan dahlan iskan ,",
38,Fri May 08 03:10:23 +0000 2020,Walikota Serahkan Bantuan APD ke Puskesmas Di Kota Manado https://t.co/cCmdjldb3U,
39,Sun Oct 19 02:35:01 +0000 2014,Hari Kesehatan Nasional di Kota Manado Semarak. âSehat Cerdas Berdaya Saingâ: Pembukaan Hari Kesehatan Nasiona... http://t.co/7swQpKFTDD,
40,Mon May 04 10:53:12 +0000 2020,"SULUT - Senkom Rescue Kota Manado mengajak masyarakat membiasakan hidup sehat, Stop Stigma Covid 19 ""Kita Sehat Indâ¦ https://t.co/0eNbAiwCgA","SULUT - Senkom Rescue Kota Manado mengajak masyarakat membiasakan hidup sehat, Stop Stigma Covid 19 ""Kita Sehat Indonesia Sehat"" 

(Minggu, 03 Mei 2020) https://t.co/k7T8RFHBGo"
41,Tue Feb 16 12:31:33 +0000 2016,Virus Zika Belum Ada dan Tidak Terdeteksi di Kota Manado https://t.co/A59DxncF16 #Humaspromanado https://t.co/16qh1onOCH,
42,Sun Oct 19 02:35:01 +0000 2014,Hari Kesehatan Nasional di Kota Manado Semarak. âSehat Cerdas Berdaya Saingâ http://t.co/cGenbFDg1y,
43,Thu Jan 16 16:59:11 +0000 2014,"â@lucky_rantung: Yg dibutuhkan masyarakat kota manado saat ini pakaian yg layak,makanan,dan obat""an... Cc @bangAiManado @ManadoKotaâsah itu",
44,Fri May 17 07:52:00 +0000 2013,Kota Manado Juara I Kinerja Program Jaminan Kesehatan Semesta http://t.co/wqg8di415r,
45,Thu Oct 30 01:06:13 +0000 2014,Dinkes Tindaklanjuti Kasus Keracunan Wakil Wali Kota Manado http://t.co/vvFSb1tmoC,
46,Fri Feb 23 14:39:07 +0000 2018,Obat Kumur Joypolinse Untuk Menghilangkan Bau Mulut | Agen Di KotaÂ Manado https://t.co/L9sDJdNALi https://t.co/B3VjDMjepJ,
47,Thu Oct 15 03:28:08 +0000 2015,ðð @ Puskesmas Ranomut Kecamatan PalDua Kota Manado https://t.co/pJ6BBSAK63,
48,Thu Feb 14 14:30:17 +0000 2013,Waspada Penyakit Musiman: IDMANADO/Manado â Curah hujan yang masih sering mengguyur kota Manado dan sekitarnya telah... http://t.co/rzK4nqT9,
49,Wed Dec 18 15:11:55 +0000 2019,Tim Kunjungan Kerja Komisi IX DPR RI yang dipimpin Ketua Komisi IX DPR RI Felly Estelita RuntuweneÂ meninjau Rumah Sâ¦ https://t.co/m1OkOrOG2F,"Tim Kunjungan Kerja Komisi IX DPR RI yang dipimpin Ketua Komisi IX DPR RI Felly Estelita Runtuwene meninjau Rumah Sakit Umum Pusat (RSUP) Prof. Dr. R.D. Kandou Manado, di Kota Manado Provinsi Sulawesi Utara, Rabu 18 Desember 2019. #KunkerDPR https://t.co/eSrxk2vJyr"
50,Wed Sep 18 23:38:03 +0000 2019,"Pembangunan Rumah Sakit Daerah (RSUD) Manado action. Kepala Dinas Kesehatan Kota Manado mengatakan, pihaknya sudahâ¦ https://t.co/26iXYUQ5tV","Pembangunan Rumah Sakit Daerah (RSUD) Manado action. Kepala Dinas Kesehatan Kota Manado mengatakan, pihaknya sudah menggelar pertemuan dengan wali kota dan perangkat daerah terkait proses tender RSUD ini. Kejaksaan turut mengawasi proyek ini. #ManadoPost #WWP"
51,Wed Nov 26 16:28:57 +0000 2014,"Gempa Bumi, Pasien RS Lari Bawa Infus: Sejumlah pasien rumah sakit (RS) di Kota Manado juga berhamburan keluar... http://t.co/W0H4u3dMys",
52,Sun Feb 04 23:37:48 +0000 2018,Rabies atau umumnya dikenal sebagai penyakit anjing gila masih menjadi perhatian serius Dinas Pertanian Kelautan daâ¦ https://t.co/1SGB3NOID0,"Rabies atau umumnya dikenal sebagai penyakit anjing gila masih menjadi perhatian serius Dinas Pertanian Kelautan dan Perikanan Kota Manado. Selama tahun 2017 lalu, sedikitnya 40 kasus tabies terjadi di Manado. #TribunManado #WWP"
53,Thu Jul 11 11:21:08 +0000 2019,"Halo #KawanPajak #270Bisa di Kota Manado dan sekitarnya, weekend nanti so ada rencana?? 

Kalo belom gabung jo dengâ¦ https://t.co/rVayBBT4A8","Halo #KawanPajak #270Bisa di Kota Manado dan sekitarnya, weekend nanti so ada rencana?? 

Kalo belom gabung jo deng torang , jalan sehat mar depe hadiah banya 

Lokasi jalan sehat itu diawali dar Pohon Kasih Di area Mega Mas pas hari Sabtu (13/7) Jam 06.00 WITA , ikut neh :) https://t.co/uCgHuxEg6e"
54,Sun Feb 24 08:00:00 +0000 2019,Banyaknya korban akibat DBD membuat Caleg Perindo Edwin Eman dan Novani Somba bergerak cepat lakukan fogging massalâ¦ https://t.co/ogr531MrJ4,"Banyaknya korban akibat DBD membuat Caleg Perindo Edwin Eman dan Novani Somba bergerak cepat lakukan fogging massal di Kota Manado. Melalui kegiatan ini diharapkan tidak ada lagi korban berjatuhan.

https://t.co/ybawox2Ziy  | Ketum Perindo @Hary_Tanoe #PerindoUpdate"
55,Wed Jul 17 23:56:19 +0000 2013,"Robby Mottoh: Warga Diminta Waspada Demam Berdarah: MANADO, OKE â Kepala Dinas Kesehatan Kota Manado, dr. Robb... http://t.co/wOUrrHfivE",
56,Fri Jan 29 06:50:01 +0000 2016,Petugas Kebersihan Manado Perlu BPJS dan Kartu Pelayanan Kesehatan Gratis https://t.co/DSnKBBnkUH #Humaspromanado https://t.co/KzkT2ug4fE,
57,Fri May 31 14:14:01 +0000 2013,"Keg. Dalam Rangka HUT kota manado, diharapkan untuk semua warga SMAN 7 Mandao mengikuti jalan sehat di lap. Tikala start jam 5 pagi, #info âº",
58,Fri Feb 01 01:19:32 +0000 2019,"Hingga Rabu (30/01/2019) sore, total penderita DBD di Kota Manado mencapai 371 orang. https://t.co/6rDMgKCgrX",
59,Thu Oct 30 15:05:19 +0000 2014,Hatta Rajasa News : Wawali Kota Manado Dilarikan ke Rumah Sakit Usai Makan di ... - http://t.co/9NZMmFRjf9: JPN... http://t.co/eeSijGKiPO,
60,Wed Jan 09 06:58:49 +0000 2019,"Waspada DEMAM BERDARAH sedang meningkat di kota manado
#jagalahkebersihan 
#demamberdarah https://t.co/zc1a6p8YPm",
61,Sat Apr 05 02:20:39 +0000 2014,"Rayakan ulang tahun dengan nyabu bareng teman2 di hotel bintang lima kota Manado, seorang dokter di Noongan ketangkap basah oleh polisi",
62,Fri Mar 22 07:49:47 +0000 2013,"DPRD Kota Manado Dukung Pembangunan RSUD: 
Richard Sualang.Manado, CSN â Dengan adanya rencana pembangunan Rum... http://t.co/ZhNUyaobjw",
63,Wed Jun 25 05:25:01 +0000 2014,"Kasus DBD Perlu Perhatian Khusus: Manado â Dewan Perwakilan Rakyat Daerah (DPRD) Kota Manado, menghimbau pemer... http://t.co/FNeveKo3Rx",
64,Tue Jan 15 09:46:32 +0000 2013,Layanan Kesehatan Gratis Untuk Warga Manado: IDMANADO/Manado- Kepala Dinas Kesehatan Kota Manado Robby Motto... http://t.co/xbNAePdL,
65,Tue Jan 29 13:10:32 +0000 2013,"Komisi D Dekot Manado, Akan Hearing Dinkes Kota Manado: Terkait Program Pelayanan Kesehatan Gratis... http://t.co/paMQBECb",
66,Thu Jan 26 03:59:02 +0000 2017,Terapi Pengobatan ImpotensiÂ di Kota Manado Rekomendasi DokterÂ Ahli https://t.co/RkM1tqjf6Z https://t.co/i0c9yyz05u,
67,Fri Apr 10 15:16:28 +0000 2015,Obat Kuat dan 'Permen  Cinta' Dijual Bebas di Manado: Di pusat perbelanjaan kota Manado dan dibeberapa tempat ... http://t.co/9cyAM5MCR9,
68,Thu Aug 30 06:15:34 +0000 2018,Dalam Rangka Hut Ke-1 Yayasan Jantung Indonesia (YJI) Cabang Kota Manado bekerjasama dengan Pemerintah Kota Manadoâ¦ https://t.co/l6jjuNW8Pg,Dalam Rangka Hut Ke-1 Yayasan Jantung Indonesia (YJI) Cabang Kota Manado bekerjasama dengan Pemerintah Kota Manado meyelenggarakan Kegiatan Pencegahan Dan Deteksi Dini Penyakit Jantung Koroner di Aula Serbaguna... https://t.co/2rG9Jjk7OE
69,Sun Oct 19 02:16:32 +0000 2014,#TuitManado Hari Kesehatan Nasional di Kota Manado Semarak. âSehat Cerdas Berdaya Saingâ #Manado #Tuit,
70,Thu Jun 28 09:00:01 +0000 2018,Tim Ombudsman RI Perwakilan Provinsi Sulawesi Utara gelar âSIDAKâ di Dinas Kependudukan dan Pencatatan Sipil Kota Mâ¦ https://t.co/dv9yswYlgL,"Tim Ombudsman RI Perwakilan Provinsi Sulawesi Utara gelar âSIDAKâ di Dinas Kependudukan dan Pencatatan Sipil Kota Manado dan UPTD Rumah Sakit Jiwa Prof. Dr. V.L. Ratumbuysang

https://t.co/jO0vNSvmwD"
71,Wed Nov 06 07:44:27 +0000 2013,"2014, Program UC Akan Beralih ke BPJS: MANADO, OKE â Kepala Dinas Kesehatan Kota Manado, dr. Robby J. Mottoh m... http://t.co/G88OZPitWU",
72,Sat Jun 13 11:46:02 +0000 2020,"PSI MANADO Menyerahkan Bantuan APD Ke Puskesmas Tikala Baru Kota Manado (9/6)
"" Mari jo torang dukung Gerakan Solidâ¦ https://t.co/qprT5nQ7UB","PSI MANADO Menyerahkan Bantuan APD Ke Puskesmas Tikala Baru Kota Manado (9/6)
"" Mari jo torang dukung Gerakan Solidaritas Lawan Covid19 bersama PSI Kota Manado.""

#DPD_PSI_Manado
#DPC_Tikala
#SolidaritasLawanCorona
#PSIBersamaRakyat https://t.co/z7rIQ2qyp4"
73,Tue Jan 29 11:44:33 +0000 2013,82 Kasus DBD Serang Kota Manado http://t.co/izJaA1Pa #RakyatSULUT,
74,Sun Nov 18 00:47:18 +0000 2018,"Dokter jimmy: ketersediaan petugas puskesmas di kota manado masih minim
Saya: hhmm.. kalo minim berarti bukan puskeâ¦ https://t.co/IjI4NhEh29","Dokter jimmy: ketersediaan petugas puskesmas di kota manado masih minim
Saya: hhmm.. kalo minim berarti bukan puskesmas namanya https://t.co/G5Ay3AqX7q"
75,Tue Jan 31 10:19:48 +0000 2017,"Data Resmi Puskesmas di Kota Manado Provinsi Sulawesi Utara Republik Indonesia, Lengkap dan Reliable https://t.co/OnaWyLQlaf",
76,Sun Oct 19 02:35:00 +0000 2014,Berita Manado: Hari Kesehatan Nasional di Kota Manado Semarak. âSehat Cerdas Berdaya Saingâ http://t.co/hDO8J73hno ~ BakuKabar,
77,Wed Aug 15 02:08:54 +0000 2018,Wali Kota Manado: Hidup Sehat dengan Bersepeda https://t.co/2IrY4Wz9g8,
78,Fri Sep 23 10:00:38 +0000 2016,"Ba jaga.. (at Stan Pameran Pembangunan Dinkes Prov. Sulut. Kayuwatu, Kota Manado) [pic] â https://t.co/K20U0XCm0C",
79,Fri May 17 10:50:29 +0000 2013,"I'm at RSUD Prof. DR. Dr. Kondou Malalayang (Kota Manado, Sulawesi Utara) http://t.co/hctd2zE5vP",
80,Thu Oct 18 08:35:15 +0000 2018,Agen Obat Herbal Pelangsing Di Kota Manado-SulawesiÂ Utara https://t.co/2zffzKtQjD https://t.co/WQlUyWmWQK,
81,Sat Feb 04 07:54:54 +0000 2017,"Info Lengkap Apotek di Kota Manado Provinsi Sulawesi Utara Republik Indonesia, Valid dan Reliable https://t.co/Hqh77EVjH2",
82,Fri Mar 10 03:18:45 +0000 2017,"Dokter Cilik SD Kemalaâ¦ (w/ Bambang Prabowo, Vivi, &amp; 3 others at SD Kemala Bhayangkari Kota Manado) [pic] â https://t.co/pKVc2Zg2lP",
83,Sun Dec 02 05:22:23 +0000 2018,"""Kami banyak mendapatkan laporan dugaan pungli yang dilakukan di sekolah dan Puskesmas. Laporan dan pengaduan ini lâ¦ https://t.co/zeydYpYoU1","""Kami banyak mendapatkan laporan dugaan pungli yang dilakukan di sekolah dan Puskesmas. Laporan dan pengaduan ini lebih banyak berasal dari kalangan orangtua siswa di sejumlah sekolah. Juga dari masyarakat yang merasa pelayananâ¦ https://t.co/MxlL9FB0yP https://t.co/68k1McAOVC"
84,Thu Dec 05 02:09:43 +0000 2019,"Bubur Manado - Tinutuan
Makanan khas dari Kota Manado, disajikan dengan campuran sayur - sayuran bergizi, sangat coâ¦ https://t.co/2GtTVtoMBL","Bubur Manado - Tinutuan
Makanan khas dari Kota Manado, disajikan dengan campuran sayur - sayuran bergizi, sangat cocok untuk sarapan sehat di hari minggu. Lagoon Resto menyediakan Tinutuan bagi anda penikmat buburâ¦ https://t.co/DcFAszE6m1"
85,Sat Nov 15 02:42:51 +0000 2014,Gempa sejenak. Semoga aman kota manado. ð¿ (with Yoserizal and dr.leida at Puskesmas Teling Atas) â https://t.co/o7woGERSzy,
86,Sat Nov 28 01:28:21 +0000 2015,"Wakili Warga Manado, Wali Kota Manado Terima Penghargaan Kota Sehat https://t.co/OM0tqM09CJ",
87,Wed Jan 30 02:22:16 +0000 2019,Dinas Kesehatan Daerah Provinsi Sulawesi Utara menyebut hingga kemarin penderita DBD sudah mencapai 1.052 orang danâ¦ https://t.co/nYSRUD7lQv,"Dinas Kesehatan Daerah Provinsi Sulawesi Utara menyebut hingga kemarin penderita DBD sudah mencapai 1.052 orang dan 13 diantaranya meninggal dunia. Ribuan penderita tersebut didominasi di tiga daerah diantaranya di kota Manado, Minahasa Utara, dan Minahasa #MostUpdate1058"
88,Fri Feb 13 00:37:09 +0000 2015,"Happy Birthday Gembala Teddy K Batasina. Semoga makin Sehat, Makin Sukses dan makin jadi berkat buat Kota Manado... http://t.co/sBhoH6ZRBL",
89,Wed Jul 26 03:23:15 +0000 2017,"Hati boleh kosong ,tapi perut nggak boleh kosong ð
.
.
#makansiang @ Puskesmas Kombos Kota Manado https://t.co/IkEMUgoyBb",
90,Wed Nov 27 17:00:51 +0000 2013,Amelia Raih Petugas Kusta Terbaik se-Sulut: Dinas Kesehatan (Dinkes) Kota Manado melalui Puskesmas Tuminting m... http://t.co/7GZH2xQtgp,
91,Tue Feb 14 05:47:06 +0000 2017,"Penandatanganan Perjanjian Kerjasama PD Pasar Kota Manado dan BPJS Kesehatan.
(Report by Stand Lee - Smartfm Manado)
#LiveReport",
92,Sun Feb 24 08:00:00 +0000 2019,Banyaknya korban akibat DBD membuat Caleg Perindo Edwin Eman dan Novani Somba bergerak cepat lakukan fogging massalâ¦ https://t.co/tRx7su5Z7i,"Banyaknya korban akibat DBD membuat Caleg Perindo Edwin Eman dan Novani Somba bergerak cepat lakukan fogging massal di Kota Manado. Melalui kegiatan ini diharapkan tidak ada lagi korban berjatuhan.

https://t.co/YYLO3EJQLK  | Ketum Perindo @Hary_Tanoe #PerindoUpdate"
93,Wed Jun 05 07:22:14 +0000 2013,"I'm at RSUD Prof. DR. Dr. Kondou Malalayang (Kota Manado, Sulawesi Utara) http://t.co/EHIhVDfTOm",
94,Mon Sep 07 23:59:28 +0000 2020,Thanks Gary_Edo: Bakal Calon Wali kota Manado @morbastiaan (MOR) dan Bakal Calon Wakil Wali kota @hjp_sure (HJP) meâ¦ https://t.co/rJLSbNetlJ,"Thanks Gary_Edo: Bakal Calon Wali kota Manado @morbastiaan (MOR) dan Bakal Calon Wakil Wali kota @hjp_sure (HJP) mendatangi Rumah Sakit Umum Daerah (RSUD) Malalayang Senin (7/09/2020) .

Kedatangan Wakil Wali kota Manado ini juga ,â¦ https://t.co/tHHEWE7IJk"
95,Tue Sep 24 23:59:38 +0000 2019,Pemkot Gelar Pengangkatan Jabatan Direktur RSUD Kota Manado https://t.co/vMHMtbQ5NX,
96,Fri Mar 22 07:57:13 +0000 2013,Berita Manado - DPRD Kota Manado Dukung Pembangunan RSUD http://t.co/NuKpSygVbo,
97,Tue Oct 04 02:54:28 +0000 2016,Pertemuan petugas Promosi Kesehatan Puskesmas sekota Manado. (at Dinas Kesehatan Kota Manado) â https://t.co/CE1b6yXNkj,
98,Sun Nov 17 23:58:13 +0000 2019,Tenaga Harian Lepas dan Kepala Lingkungan di Kota Manado diikutsertakan program santunan kecelakaan kerja dan kematâ¦ https://t.co/igeUvH3IYj,Tenaga Harian Lepas dan Kepala Lingkungan di Kota Manado diikutsertakan program santunan kecelakaan kerja dan kematian di BPJS Ketenagakerjaan. #KoranSindo #WWP
99,Thu Feb 07 14:24:19 +0000 2019,"DBD Makan Korban, Perindo Giatkan Fogging di Kota Manado

https://t.co/EhyvNrPySC",
100,Tue Feb 07 05:52:32 +0000 2017,"Data Resmi Puskesmas di Kota Manado Provinsi Sulawesi Utara Republik Indonesia, Lengkap dan Reliable https://t.co/zPNq6X5l6m",
101,Tue Jan 08 04:10:35 +0000 2019,Jumlah kasus demam berdarah di kota Manado meningkat dan sudah masuk dalam kasus luar biasa. Pasien DBD memenuhi ruâ¦ https://t.co/bF0zNVBiaN,Jumlah kasus demam berdarah di kota Manado meningkat dan sudah masuk dalam kasus luar biasa. Pasien DBD memenuhi ruangan rumah sakit. #MetroSiang @Metro_TV
102,Wed Aug 28 12:10:24 +0000 2019,"Ferdinan Sumarauw Daniel, warga Lingkungan VI, Kelurahan Banjer, Kecamatan Tikala, Kota Manado, Sulawesi Utara. Menâ¦ https://t.co/tAFoRmYEmc","Ferdinan Sumarauw Daniel, warga Lingkungan VI, Kelurahan Banjer, Kecamatan Tikala, Kota Manado, Sulawesi Utara. Meninggal dunia 4 jam setelah mengucapkan dua kalimat syahadad karena sakit asma yang dideritanya.
#IbukotaPesananCukong

 https://t.co/f18n8VZu51"
103,Thu Mar 30 01:12:26 +0000 2017,"Ibadah Bersama Dinkes Pemkot Mdo
Oleh Pdt Felix Lengkeyðð» (at Dinas Kesehatan Kota Manado ) [vid] â https://t.co/0iUfUn3D8z",
104,Tue Jan 15 00:34:18 +0000 2019,"Wabah DBD terjadi bukan hanya karena musim yang berganti, melainkan juga pola pembangunan kota.

Wabah DBD di Kotaâ¦ https://t.co/tPeSdcFoZA","Wabah DBD terjadi bukan hanya karena musim yang berganti, melainkan juga pola pembangunan kota.

Wabah DBD di Kota Manado sepertinya telah ditemukan sejak awal tahun 1970-an. Tidak lama setelah kasus di Surabaya. Sebuah... https://t.co/R2i8PIHQh3"
105,Tue Jan 08 05:01:05 +0000 2019,"@null Cegah DBD, Dinkes Manado Lakukan Pengasapan Dinas Kesehatan (Dinkes) Kota Manado  https://t.co/cOGbUsNJ4s",
106,Fri Jul 12 06:31:16 +0000 2013,Kesehatan Masyarakat Prioritas Pemerintah Kota Manado: Manado â Terkait program Car free Day (Hari bebas kenda... http://t.co/mQpvhjly0m,
107,Fri May 17 08:11:47 +0000 2013,Kota Manado Juara I Kinerja Program Jaminan Kesehatan Semesta: IDMANADO/Manado-Kota Manado gemilang dengan... http://t.co/5IXKart9m6,
108,Wed Aug 07 01:33:05 +0000 2013,"I'm at RSUD Prof. DR. Dr. Kandou Malalayang (Kota Manado, Sulawesi Utara) http://t.co/nX2xG1A1c8",
109,Sat Oct 05 23:34:13 +0000 2019,Kamis (03/10/2019) di Aula Sam Ratulangi Lantai 4 Kejati Sulut dilaksanakan Rapat TP4D Kejati Sulut dgn Pemkot Manaâ¦ https://t.co/0bjhK3rbHO,"Kamis (03/10/2019) di Aula Sam Ratulangi Lantai 4 Kejati Sulut dilaksanakan Rapat TP4D Kejati Sulut dgn Pemkot Manado membahas permohonan pendampingan kepada TP4D Kejati Sulut untuk Pekerjaan Pembangunan RSUD Kota Manado pada Dinkes Kota Manado Tahun Anggaran 2019.
#KejaksaanRI https://t.co/kg6bdjude0"
110,Tue Feb 12 16:22:36 +0000 2019,Warga Sambut Antusias Periksa Kesehatan Gratis dari Perindo Kota Manado [News]. https://t.co/f2frtrTPhV,
111,Tue Jul 14 07:10:06 +0000 2015,"HBD kota manado,,,panjang umur deng sehat sehat selalu neh  {}",
